{
  "schema_version": "0.1",
  "source": {
    "module": "M01",
    "artifact_path": "D:\\CodexProjects\\re_rpotocol\\data\\acceptance\\frozen-20260910\\integration\\m01\\result.json",
    "artifact_sha256": "e236f49ff1c96489ae2973f31b88270953303bb9ed90182d90d97bbb724b3ac7",
    "record_id": "download-01-d8f9c37a5714",
    "schema_version": "0.1"
  },
  "status": "ok",
  "parameters": {
    "max_stream_bytes": 67108864
  },
  "sources": [
    {
      "source_id": "payload-download-01-d8f9c37a5714-tcp-stream-0-node1_to_node0-0000",
      "protocol": "http",
      "stream_id": "download-01-d8f9c37a5714-tcp-stream-0",
      "flow_id": "download-01-d8f9c37a5714-tcp-flow-0",
      "direction": "node1_to_node0",
      "recognition_basis": "strict_http_start_line_and_framing_headers",
      "message_index": 0,
      "message_type": "response",
      "start_line": "HTTP/1.1 200 OK",
      "headers": {
        "server": "re_rpotocol-acceptance/0.1 Python/3.13.9",
        "date": "Thu, 10 Sep 2026 12:44:50 GMT",
        "content-type": "text/plain; charset=utf-8",
        "content-length": "101",
        "x-content-sha256": "215ff970eee6a68f5e5a27bef8bea4026824a1e45d2c6024e79812617dee7c07"
      },
      "framing": "content_length",
      "content_encoding": null,
      "source_ranges": [
        {
          "start": 252,
          "end": 353
        }
      ],
      "source_artifact": {
        "artifact_path": "D:\\CodexProjects\\re_rpotocol\\data\\acceptance\\frozen-20260910\\integration\\m01\\streams\\download-01-d8f9c37a5714-tcp-0-node1_to_node0.bin",
        "artifact_sha256": "38c0c8258fcb622ad3b00b3973aa9ec8d113e82a81f763d6e41c7afad78bf022",
        "length": 353
      },
      "output": {
        "artifact_ref": "payloads/payload-download-01-d8f9c37a5714-tcp-stream-0-node1_to_node0-0000.bin",
        "sha256": "215ff970eee6a68f5e5a27bef8bea4026824a1e45d2c6024e79812617dee7c07",
        "length": 101
      },
      "completeness": "complete",
      "limitations": []
    }
  ],
  "unparsed_ranges": [],
  "metrics": {
    "stream_count": 1,
    "direction_count": 2,
    "payload_count": 1,
    "complete_payload_count": 1,
    "output_bytes": 101
  },
  "warnings": []
}
